{
  "schema_contract": "station_calendar_provider.v1",
  "id": "declared_ground_network_demo",
  "provider_id": "declared_ground_network_demo",
  "entries": [
    {
      "id": "equator_prime_maintenance_1",
      "ground_station_id": "equator_prime",
      "availability": "maintenance",
      "starts_at_s": 100.0,
      "ends_at_s": 220.0,
      "capacity_fraction": 0.0
    },
    {
      "id": "equator_prime_reservation_1",
      "ground_station_id": "equator_prime",
      "availability": "reserved",
      "starts_at_s": 300.0,
      "ends_at_s": 420.0,
      "capacity_fraction": 1.0,
      "reservation_id": "reservation_equator_prime_1",
      "reserved_by": "ops_team_b",
      "reservation_status": "reserved"
    }
  ],
  "provenance": {
    "source": "declared_provider_fixture",
    "trust_boundary": "operator_declared_station_calendar"
  },
  "assumptions": {
    "boundary": "artifact_only_no_provider_reservation",
    "network_access": "none"
  }
}
